{
  "contract_version": "1.0",
  "task_id": "crawl-local-example",
  "idempotency_key": "SRC-MY-MIDA:https://example.invalid/document:sha256-example",
  "source_id": "SRC-MY-MIDA",
  "url": "https://example.invalid/document",
  "canonical_url": "https://example.invalid/document",
  "published_at": null,
  "crawled_at": "2026-08-20T00:00:00Z",
  "content_hash": "sha256:example",
  "raw_object_uri": "s3://mipi-local/raw/example",
  "language": "en",
  "collection_relevance": "unknown",
  "verification_hint": null,
  "publication_status": "staged",
  "review_flags": []
}

